{
  "meta": {
    "slug": "novi-vinodolski",
    "sprachen": ["de", "en"],
    "standardsprache": "de",
    "erstellt_am": "2026-10-01",
    "stand": "2026-10-01",
    "status": "veroeffentlicht",
    "suchmaschinen": false
  },
  "gastgeber": {
    "anzeigename": "Manu & Stephan",
    "personen": [{ "vorname": "Manu" }, { "vorname": "Stephan", "nachname": "Bohr" }],
    "anrede": "ihr",
    "kontakt": {
      "email": "stephan.bohr@web.de",
      "telefon": "+49 170 7863501",
      "mail_betreff": { "de": "Novi Vinodolski – erzählt uns mehr", "en": "Novi Vinodolski – tell us more" },
      "mail_text": { "de": "Hallo Manu, hallo Stephan,\n\nwir sind neugierig geworden. Schickt uns gern die Unterlagen.\n\nViele Grüße", "en": "Hi Manu, hi Stephan,\n\nwe are curious. Please send us the documents.\n\nBest wishes" }
    },
    "foto": { "datei": "bilder/privat/wir.jpg", "quelle": "eigen", "alt": { "de": "Manu & Stephan an der Chill-Terrasse", "en": "Manu & Stephan at the chill terrace" } }
  },
  "objekt": {
    "name": "Mövenpick Residences Kvarner Bay",
    "ort": "Novi Vinodolski",
    "region": "Kvarner-Bucht",
    "land": "Kroatien",
    "anbieter": "NV ADRIA CONDOS d.o.o.",
    "betreiber_marke": "Mövenpick (Accor)",
    "material_genehmigt": true,
    "praemie_offenlegen": true,
    "kurzbeschreibung": {
      "de": "304 Residenzen in 35 Gebäuden, verteilt auf mehr als 150.000 m² Parklandschaft direkt am Meer. Jede hat einen eigenen Balkon oder eine Terrasse.",
      "en": "304 residences in 35 buildings, spread across more than 150,000 m² of parkland right by the sea. Each has its own balcony or terrace."
    }
  },
  "hero": {
    "label": { "de": "Eine Einladung an unsere Freunde", "en": "An invitation to our friends" },
    "titel": { "de": "Wir haben unseren Platz am Meer gefunden.", "en": "We have found our place by the sea." },
    "untertitel": { "de": "In Novi Vinodolski an der Kvarner-Bucht – anderthalb Flugstunden von Frankfurt. Und wir fänden es großartig, wenn ihr dort unsere Nachbarn würdet.", "en": "In Novi Vinodolski on Croatia's Kvarner Bay – an hour and a half by plane from Frankfurt. And we would love it if you became our neighbours there." },
    "bild": { "datei": "bilder/strand-pool.jpg", "quelle": "anbieter" },
    "button_kontakt": { "de": "Schreibt uns", "en": "Write to us" },
    "button_warum": { "de": "Warum wir das erzählen", "en": "Why we are telling you this" }
  },
  "brief": {
    "label": { "de": "Ein paar Zeilen von uns", "en": "A few lines from us" },
    "anrede": { "de": "Liebe Freunde,", "en": "Dear friends," },
    "absaetze": [
      { "de": "im Frühjahr sind wir für ein Wochenende nach Kroatien geflogen, eigentlich nur zum Anschauen. Zurückgekommen sind wir mit einer Reservierung für ein Apartment in den Mövenpick Residences Kvarner Bay.", "en": "This spring we flew to Croatia for a weekend, really just to have a look. We came back having reserved an apartment at the Mövenpick Residences Kvarner Bay." },
      { "de": "Gerade jetzt, am 1. Oktober 2026, sind wir wieder hier. Was uns persönlich jedes Mal fasziniert: Das Wasser ist kristallklar, die Menschen sind freundlich, das Meer ist einfach gigantisch – und wir genießen die Ruhe.", "en": "Right now, on 1 October 2026, we are here again. What fascinates us personally every time: the water is crystal clear, the people are friendly, the sea is simply immense – and we enjoy the quiet." }
    ],
    "unterschrift": "Manu & Stephan"
  },
  "gruende": [
    { "titel": { "de": "Toplage direkt am Meer", "en": "A prime location on the water" }, "text": { "de": "Die Residenzen liegen in einem großen Park direkt an der Bucht, die ersten Reihen nur 50 bis 80 Meter vom Meer.", "en": "The residences sit in a large park right on the bay; the first rows are just 50 to 80 metres from the sea." } },
    { "titel": { "de": "20 % Rabatt als Eigentümer", "en": "20% off as an owner" }, "text": { "de": "Eigentümer bekommen 20 % Nachlass in allen Restaurants und Bars des Resorts, auf Wellness- und Spa-Anwendungen – dazu weltweit den Platinum-Status bei Accor.", "en": "Owners get 20% off in all of the resort's restaurants and bars and on spa treatments – plus Accor Platinum status worldwide." } },
    { "titel": { "de": "Eigentum ohne Kümmern", "en": "Ownership without the chores" }, "text": { "de": "Für uns einer der wichtigsten Punkte: Pflege, Reinigung, Reparaturen und Garten übernimmt das Resort. Und wenn wir nicht da sind, vermietet das Hotel das Apartment für uns.", "en": "For us this is one of the most important points: upkeep, cleaning, repairs and the garden are handled by the resort. And when we are not there, the hotel rents the apartment out for us." }, "hervorgehoben": true }
  ],
  "eigenes_objekt": {
    "titel": { "de": "Das Apartment, das wir uns ausgesucht haben", "en": "The apartment we picked" },
    "einleitung": { "de": "Wir haben uns für eine Wohnung im Erdgeschoss in der ersten Reihe am Meer entschieden. Für uns ist sie schlicht ideal:", "en": "We chose a ground-floor apartment in the first row by the sea. For us it is simply ideal:" },
    "merkmale": [
      { "titel": { "de": "Vier Schlafgelegenheiten", "en": "Sleeps four" }, "text": { "de": "Genug Platz für uns und für Besuch.", "en": "Enough room for us and for guests." } },
      { "titel": { "de": "Hunde dürfen mit", "en": "Dogs are welcome" }, "text": { "de": "Genau deshalb haben wir das Erdgeschoss genommen.", "en": "That is exactly why we went for the ground floor." } }
    ],
    "bild": { "datei": "bilder/terrasse.jpg", "quelle": "anbieter", "bildunterschrift": { "de": "Eine private Terrasse – Visualisierung des Entwicklers.", "en": "A private terrace – developer's visualisation." } },
    "modell": { "datei": "bilder/privat/modell-anlage.jpg", "quelle": "eigen", "bildunterschrift": { "de": "Modell der gesamten Anlage: Unser Haus ist rot markiert.", "en": "Model of the whole resort: our building is marked in red." } },
    "hinweis": { "de": "Auch die Häuser in der zweiten und dritten Reihe finden wir sehr attraktiv – die Anlage hat einiges an Gefälle, man hat auch von dort einen super Blick aufs Meer.", "en": "We find the buildings in the second and third rows very attractive too – the site slopes quite a bit, so you have a great view from there as well." }
  },
  "umgebung": [
    {
      "titel": { "de": "Die Plitvicer Seen – hier wurde Winnetou gedreht", "en": "Plitvice Lakes – where Winnetou was filmed" },
      "text": { "de": "Türkisfarbene Seen, Wasserfälle und Holzstege mitten übers Wasser. Hier wurde „Der Schatz im Silbersee“ gedreht.", "en": "Turquoise lakes, waterfalls and boardwalks right across the water. This is where \"The Treasure of Silver Lake\" was filmed." },
      "bilder": [
        { "datei": "bilder/privat/wasserfaelle.jpg", "quelle": "eigen" },
        { "datei": "bilder/privat/plitvice-see.jpg", "quelle": "eigen" },
        { "datei": "bilder/privat/wir-plitvice.jpg", "quelle": "eigen" }
      ],
      "links": [
        { "label": { "de": "Nationalpark Plitvicer Seen", "en": "Plitvice Lakes National Park" }, "url": "https://np-plitvicka-jezera.hr/de/", "art": "offiziell" },
        { "label": { "de": "Winnetou-Drehorte: Filmszene und heute", "en": "Winnetou locations: film scene vs. today" }, "url": "https://www.otto-photo.de/specials/winnetou/", "art": "bericht" }
      ],
      "layout": "drei-bilder"
    },
    {
      "titel": { "de": "Die Insel Krk, direkt gegenüber", "en": "The island of Krk, right across the bay" },
      "text": { "de": "Landschaftlich wunderschön: viele Hügel mit tollen Aussichten, superschöne Strände und zwei schöne Altstädtchen. Im Süden liegt Baška mit seinem fast zwei Kilometer langen Strand.", "en": "Beautiful: lots of hills with great views, gorgeous beaches and two lovely little old towns. In the south lies Baška with its almost two-kilometre-long beach." },
      "bilder": [{ "datei": "bilder/privat/krk-baska.jpg", "quelle": "eigen" }],
      "links": [
        { "label": { "de": "Tourist-Information Insel Krk", "en": "Krk island tourist information" }, "url": "https://krk.hr/de/", "art": "offiziell" },
        { "label": { "de": "Tourist-Information Baška", "en": "Baška tourist information" }, "url": "https://www.visitbaska.hr/de", "art": "offiziell" }
      ],
      "layout": "ein-bild"
    }
  ],
  "fotos": {
    "einleitung": { "de": "Keine Visualisierung, kein Prospekt: Diese Bilder haben wir selbst hier im Hotel gemacht – Stand 1. Oktober 2026.", "en": "No renderings, no brochure: we took these pictures ourselves here at the hotel – as of 1 October 2026." },
    "bilder": [
      { "datei": "bilder/privat/chill-terrasse.jpg", "titel": { "de": "Die Chill-Terrasse", "en": "The chill terrace" }, "text": { "de": "Ganztags offen – und am schönsten abends, mit cooler Musik und offenem Feuer.", "en": "Open all day – and best in the evening, with good music and an open fire." }, "groesse": "breit" },
      { "datei": "bilder/privat/sonnenuntergang.jpg", "titel": { "de": "Sonnenuntergang", "en": "Sunset" }, "text": { "de": "Vom Balkon aus.", "en": "Seen from the balcony." }, "groesse": "schmal" },
      { "datei": "bilder/privat/kinderparadies.jpg", "titel": { "de": "Ein Kinderparadies", "en": "A paradise for children" }, "text": { "de": "Hier ist alles super kinderfreundlich. Wer von euch an seine Enkel denkt, ist hier sicher gut aufgestellt.", "en": "Everything here is wonderfully child-friendly. Those of you thinking of your grandchildren are certainly in good hands here." }, "groesse": "schmal", "bildausschnitt": "50% 30%" }
    ]
  },
  "projektstand": {
    "einleitung": { "de": "Damit ihr es richtig einordnet: Noch ist nicht alles fertig. Das Hotel läuft, unsere Wohnung und Teile der Anlage sind noch im Bau.", "en": "To be clear: not everything is finished yet. The hotel is up and running, while our apartment and parts of the resort are still being completed." },
    "zeitleiste": [